{
  "$schema": "../../sdk/plugin.schema.json",
  "manifestVersion": 1,
  "id": "plugin-template",
  "name": "插件模板",
  "version": "1.0.0",
  "author": "fuyu2022",
  "dependencies": {"plugins": {}, "libraries": {"color-utils": {"version": "1.0.0", "entry": "vendor/color-utils.mjs"}}},
  "entry": "src/main.js",
  "updateUrl": "https://raw.githubusercontent.com/fuyu2022/desktop-art-plugin/main/updates/plugin-template.json",
  "sdkVersion": 2,
  "surface": "foreground"
}
